id,title,type,description,release_year,age_certification,runtime,genres,production_countries,seasons,imdb_id,imdb_score,imdb_votes,tmdb_popularity,tmdb_score
tm359828,Sightings,MOVIE,A dysfunctional family under suspicion of murder after three bodies mysteriously appear on their ranch are terrorised by what they can only describe as Bigfoot.,2017,,88,"['drama', 'action', 'thriller', 'scifi']",['US'],,tt4765870,3.6,384.0,3.37,5.3
tm417838,Swamp Zombies 2,MOVIE,"The hottest reality TV Show in the world, ""Lucky Stiffs"", is about to get even more hot. Contestants from all over the globe try to win big cash prizes and fame by competing on the show against each other and survive the shows ""stars"".....zombies!!. However, there's a problem, a renegade contestant (""Mouse"") is trying to expose the show as unethical and the show's producer's are grasping at straws to find Mouse. When all the producer's attempts have failed, he's left with one choice...to free ""Jack"" from a top secret Black ops prison and send him into the show. Jack has the kung fu skills to stay alive to find Mouse and bring her to the Producer......and he knows a thing or two about zombies.",2018,,72,"['horror', 'scifi', 'action', 'comedy']",['US'],,tt7520184,4.4,108.0,2.38,5.8
tm287708,Star Raiders: The Adventures of Saber Raine,MOVIE,Saber Raine is hired to guide three elite soldiers on a rescue mission to recover a prince and princess who have been abducted from their home world. The trail leads Saber and his allies to a planet deep within uncharted space that is inhabited by strange mutated creatures.,2017,,83,['scifi'],['US'],,tt2039380,3.0,631.0,6.1,3.8
tm233540,Kill Game,MOVIE,"In the fictional town of Grace Arbor the answers are never clear.Who is underneath the mask?PRANK is the story of a group of high school kids who amuse themselves by pulling pranks on unsuspecting students and teachers. They are all popular, good looking, the kids voted most likely to succeed. But at their core lies a cruelty and shallowness which comes with the territory of privilege. One night, a prank goes horribly wrong and a teenager is killed. The gang covers it up as a drowning accident but five years later, their lives are turned upside down when Jimmy Edwards, is killed by a serial killer wearing a haunting Marilyn Monroe mask. Soon, the gang are killed one by one in manners mirroring the pranks they pulled in high school. Is it revenge? Is it karma?",2017,,102,['horror'],['US'],,tt3024324,4.0,750.0,3.342,4.9
tm364840,Division 19,MOVIE,"In 2039, jails have been turned into online portals where the public gets to choose what prisoners eat, wear, watch and who they fight. So successful is Panopticon TV, it is about to be rolled out to a whole town, providing subscribers even more choice.",2017,,93,"['thriller', 'action', 'scifi']","['US', 'GB']",,tt2492344,5.0,2582.0,4.197,5.0
tm416271,Another Soul,MOVIE,A couple on the run battle to save their daughter from possession by a demon.,2018,,78,"['horror', 'thriller']",['US'],,tt5165620,2.2,291.0,4.868,4.7
tm427375,The Tokoloshe,MOVIE,"Busi, a young destitute woman with dangerously repressed emotions, lands a job as a cleaner at a rundown hospital in the heart of Johannesburg. Desperate for the money so she can bring her younger sister to Johannesburg, she must cope despite the predatory and corrupt hospital manager. When Busi discovers an abandoned young girl in the hospital, who believes she is tormented by a supernatural force, Busi must face her own demons from her past in order to save the child from the abusive monster that pursues them both relentlessly.",2018,,92,"['thriller', 'horror']",['ZA'],,tt8047262,4.4,173.0,2.331,5.1
tm427364,Killer Weekend,MOVIE,"When a hopeless stag party goes on a mock zombie survival weekend, an unfortunate turn of events leaves them fighting for their lives.",2018,,85,"['comedy', 'thriller', 'action', 'horror']",['GB'],,tt6732748,4.7,663.0,4.436,5.1
tm443325,Alpha Wolf,MOVIE,"When Virginia and her husband Jack spend a long weekend in the idyllic countryside, they encounter a creature that tears their lives apart. While the attack has an effect on each of them, it brings out the worst in Jack.",2018,,90,"['horror', 'thriller']",['US'],,tt7712746,3.3,365.0,7.372,6.5
tm345896,Killer Piñata,MOVIE,"A possessed piñata, seeking to avenge the savagery that humanity has inflicted on his kind, picks off a group of friends, one by one, in an unending night of terror.",2017,,87,"['horror', 'comedy']",['US'],,tt4840644,4.1,219.0,1.798,6.0
tm408955,American Exorcist,MOVIE,"A paranormal investigator, trapped in a haunted skyscraper on Christmas Eve. The skeptical young woman, Georgette Dubois, is horrified once confronted with the reality of the supernatural. She risks life and limb to escape her ghoulish prison, stranded on the 11th floor.",2018,,90,"['horror', 'comedy']",['US'],,tt4312842,2.8,210.0,7.501,5.7
tm323470,Circus Kane,MOVIE,"A reclusive circus master invites a group of social media stars to his house of haunts. Anyone who can make it out before being scared into submission will earn $250,000 - but the stars soon learn they are not only competing for money, but also fighting for their lives.",2017,,88,['horror'],['US'],,tt6164014,4.5,996.0,7.681,4.1
tm450287,BraveStorm,MOVIE,"In the year 2050, mankind is extinct. The last survivors travel back in time to stop the invader, Killgis, aided by roboticist Kenichiro Kurenai. When they arrive at the past, they start to build a giant robot, Red Baron, and the pilot of the Red Baron races against time aided by reinforced humans to identify the alien in a fierce battle which starts in Tokyo for the survival of Earth. This is a re-imagining of the 1970s TV series' ""Silver Kamen"" and ""Super Robot Red Baron"".",2017,,81,"['action', 'scifi']",['JP'],,tt6403382,4.7,263.0,3.284,5.6
tm311953,Shock Wave,MOVIE,"When a terrorist who specializes in explosives takes hold of an underground tunnel, he threatens to kill hostages if his demands are not met.",2017,,119,"['crime', 'action', 'thriller']","['HK', 'CN']",,tt5847286,6.3,3454.0,15.258,6.9
tm418912,Bodysnatch,MOVIE,Recent college graduates joyride in a stolen cop car only to uncover a secret that will doom mankind.,2018,,81,"['scifi', 'thriller']",['US'],,tt4465438,3.0,235.0,2.235,2.0
tm419262,The Kaos Brief,MOVIE,Hacked footage reveals mysterious events surrounding the abduction of four teenagers.,2017,,80,"['horror', 'scifi']",['US'],,tt5575258,4.5,347.0,3.468,4.9
tm350144,House on Elm Lake,MOVIE,"A man convinced that Lucifer was within him brutally murdered his wife and child in satanic sacrifice. Now, years later, Eric, Hayley and their daughter Penny, move into the same house after being left unsold on the market.",2017,,96,['horror'],['GB'],,tt6333200,3.8,1294.0,3.034,3.5
tm414165,Harmony,MOVIE,"Born with an energetic power to absorb fear from others, a young woman must find love to balance the fears of her own and fight an ever growing storm of negative energy.",2018,,97,"['romance', 'thriller', 'fantasy']",['AU'],,tt5583554,5.5,1123.0,4.133,6.7
tm356195,Muse,MOVIE,A painter's life is forever changed when a mythical and deadly spirit from Celtic lore – a Leannán Sí – becomes his muse and lover.,2018,R,95,"['scifi', 'thriller', 'drama', 'fantasy', 'horror', 'romance']",['US'],,tt3951206,5.2,398.0,2.454,5.6
tm311477,Ghosts of Darkness,MOVIE,"Two paranormal investigators are unexpectedly thrown together in the hope of solving a 100 year mystery. Locked for three nights in a house with a dark and unsettling past, the two investigators must put their differences to one side and work together. They soon discover the myths and stories are nothing compared to what actually resides within the eerie walls of Richwood Manor. Scepticism and showmanship are soon put to one side when the two investigators realise there is more at stake than just their professional reputation. For once they have stumbled onto the real thing, but this time it's their own lives at stake.",2017,,82,"['horror', 'comedy']",['GB'],,tt4705740,4.9,1895.0,2.962,5.7
tm367196,60 Seconds to Die,MOVIE,"Horror Anthology ""60 second short films that will scar you for a lifetime""",2017,,94,['horror'],['GB'],,tt5134248,3.7,175.0,0.9,
tm322158,Reset,MOVIE,"In 2025, a scientist on the verge of making a major discovery related to time travel is suddenly put in peril when a rival kidnaps her young son and demands a hefty ransom: her entire research.",2017,R,106,"['action', 'scifi', 'thriller']",['CN'],,tt5342650,5.3,1235.0,9.959,7.0
tm347810,The Tag-Along 2,MOVIE,"When social worker Shu-fen discovers that her pregnant teenage daughter Ya-ting has disappeared, her search for Ya-ting ends her with many horrifying mysteries…  Meeting the mysterious Mei-hua who imprisons her own daughter inside her house covered with papers written with spells and encountering the missing and pregnant Yi-chun in an abandoned hospital, the trio returns to the Red Forest to rescue Ya-ting and Shu-fen finally realizes that the deepest fear arises from love…",2017,,108,"['thriller', 'horror']",['TW'],,tt6295898,5.7,1101.0,4.688,6.8
tm453592,Dry Blood,MOVIE,"In an attempt to kick his drug habit, Brian heads to his cabin and calls upon his friend Anna for help. When he gets there, Brain is harassed by the local sherif and haunted by the ghosts in his cabin.",2017,,83,['horror'],['US'],,tt5195828,4.5,485.0,1.582,4.3
tm346027,The Atoning,MOVIE,"Vera, Ray, and Sam, a seemingly normal family, are haunted by more than mere ghosts. The lingering horror of their past threatens their ability to function as a loving family until they become enlightened by a mystical encounter. From that moment on, they're thrust into a horror worse than anything they've ever experienced. Personal demons manifest and tear the family apart from the inside out as they come to terms with their past.",2017,,89,"['horror', 'thriller', 'drama']",['US'],,tt5854198,4.1,873.0,7.987,5.7
tm357319,Crystal Inferno,MOVIE,Disaster hits when two teenagers are caught in a fire on the 20th floor of a skyscraper. Their parents are on the 60th. Will they survive the flames?,2017,,92,"['action', 'horror', 'drama', 'thriller', 'documentation', 'european']","['BE', 'FR']",,tt10090222,3.6,602.0,5.89,5.3
tm233420,One Under the Sun,MOVIE,"Astronaut Kathryn Voss, sole survivor of a disastrous space shuttle mission, is a distraught mother desperate to reunite with her terminally ill daughter but becomes a wanted fugitive after discovering she possesses an extraordinary gift.",2017,,102,"['scifi', 'drama', 'thriller']",['US'],,tt5110386,3.5,607.0,1.807,3.3
tm1081161,Red Rover,MOVIE,"After feeling he has nothing left to live for on earth, a lonely geologist tries to qualify for a one-way mission to Mars with the help of an offbeat musician who is just as lost as he is.",2018,,95,"['romance', 'comedy']",['CA'],,tt7520766,6.5,214.0,1.571,5.8
tm414326,The Aliens,MOVIE,A UFO believer must choose between the aliens above he has never seen or the mysterious guide who appears in his campsite week after week.,2018,,105,"['drama', 'scifi']",['US'],,tt6080460,6.0,69.0,4.944,5.7
tm535483,Rage of the Mummy,MOVIE,"Defying an ancient curse, a group of occultists steal thirteen sacred relics from the tomb of Prince Horus-Kan in order to feed their supernatural powers. Now, the three thousand year old mummy prince must hunt down the stolen relics and bring deadly vengeance upon the perpetrators. For Detectives Blake and Crawford, the body count is piling up. Can they stop the mummy from his deadly rampage?",2018,,90,['horror'],['XX'],,tt6080382,4.2,60.0,0.6,
tm436053,Strange Nature,MOVIE,"The first film to expose unsolved wildlife deformity outbreaks and where they may lead.  Based on a true unsolved ecological mystery, thousands of hideously deformed frogs have turned up in the waters of Minnesota. As seen through the eyes of a one hit wonder single mother and her 11 year old son, a small town struggles with the unknown when the deadly mutations move beyond the ponds.",2018,,100,"['horror', 'fantasy', 'thriller', 'scifi', 'drama']",['US'],,tt5812124,4.3,668.0,6.549,6.1
tm240831,Slay Belles,MOVIE,"While urban exploring in an abandoned amusement park, three cosplaying girls accidentally unleash the vicious holiday beast known as Krampus. With the help of Santa Claus, can these girls stop Krampus from his killing spree?",2018,,77,"['horror', 'comedy']",['XX'],,tt3526622,4.2,578.0,1.65,4.4
tm494838,Wicked Witches,MOVIE,"After being thrown out of his home by his wife for being promiscuous, Mark finds himself back at Dumpling Farm, a place of youthful memories and parties, but things aren't quite right. His old buddy Ian, who has never left the place, is possessed by a group of demonic, flesh-eating Witches. Using Ian and his farm, these beautiful Witches honey trap Mark and his friends to consume their souls.",2018,,79,['horror'],['GB'],,tt8983294,3.1,277.0,3.028,3.5
tm362840,Devil's Trail,MOVIE,"Two reality TV stars are experts at survival, but when they decide to embark upon the legendary home of the Jersey Devil can they survive? Reality TV just got real.",2017,,73,['horror'],['US'],,tt7741530,3.4,201.0,2.098,6.1
tm403804,Anabolic Life,MOVIE,"A young man obsessed with body image is thrust into a world of drugs, crime, and deception.",2017,PG-13,89,"['thriller', 'sport', 'drama']",['US'],,tt8669008,6.0,364.0,2.442,3.7
tm480855,Doe,MOVIE,"A man wakes up with no memory of his past but the ability to speak dozens of languages fluently. After finding a clue about his former self, he will race against time to discover his true identity.",2018,,98,['thriller'],['US'],,tt6807324,5.6,651.0,3.658,5.9
tm428233,Aura,MOVIE,A couple discover Kirlian Photography apparatus in their new house. Intrigued by the concept of photographing peoples' Auras they unwittingly release an ancient evil. Only the local psychic can help and she knows far more than she reveals.,2018,,82,['horror'],['XX'],,tt7631320,3.4,525.0,4.01,3.2
tm311712,The Last Scout,MOVIE,"In 2065, the crew of the Pegasus are searching for a new home for humanity. As they approach their potential new world, the discovery of another ship could be the key to their salvation, or doom them and the rest of humanity to extinction.",2017,,107,"['scifi', 'thriller', 'action', 'drama']",['GB'],,tt2923834,4.5,2573.0,5.444,4.3
tm376349,The Night Sitter,MOVIE,"A scheming con artist poses as the innocent babysitter ""Amber"" to steal from a wealthy occult enthusiast with a reclusive son, Kevin. Her crew arrives to clean out the house just as Kevin stumbles upon a prized artifact and unwittingly summons a trio of witches known as The Three Mothers.",2018,,88,"['horror', 'comedy']",['US'],,tt6942194,4.9,1009.0,2.833,5.0
tm318398,Instant Death,MOVIE,"A vicious gang war for drug dominance draws in a disturbed Special Forces veteran John Bradley. Trying to adjust to normal life and haunted by inner demons of a violent past, the underworld's retribution on his last connection to humanity, a daughter and grandchild leads to a descent of fury and violence that not even the brutality of gangland is prepared for.",2017,,84,['action'],['GB'],,tt4447090,4.1,552.0,8.664,5.6
tm423362,No Good Heroes,MOVIE,"After living peacefully in the caverns of a small town, a stranded group of aliens turn deadly as they fight for their existence, betraying the compassionate chief of police who has protected them for 28 years.",2018,,91,"['drama', 'comedy', 'thriller', 'horror', 'scifi']",['US'],,tt4841708,3.4,294.0,2.298,5.5
tm316182,Among Us,MOVIE,"After the mysterious death of their young son, a couple desperately flees to a remote lake house to escape the unrelenting haunting following them only to discover the mysterious entity is still very much a part of their lives.",2017,R,91,"['horror', 'thriller', 'drama']",['US'],,tt4462240,4.4,337.0,3.609,6.1
tm430578,Alienators,MOVIE,"Two amateur Ufologists investigate a woman's claim that aliens are watching her. This is that footage, compiled and released by The Civilian Department of Ufology, a privately owned UFO research and investigation organization.",2018,,104,"['comedy', 'fantasy']",['XX'],,tt6814106,5.3,131.0,1.153,7.0
tm419078,Anunnaki,MOVIE,"450,000 years ago our ancestors descended from the heavens to engineer the first human beings. To us they were Giants that ruled as Gods over mankind. Now new evidence and scientific research acknowledges their existence on earth but reveals when they will return. The truth of their real origin and purpose is much more bizarre and amazing than anything previously believed. From the Garden of Eden to the Great Flood; from the God of the Bible to the secrets of Enoch all shall be revealed. (IMDB)",2018,,66,"['fantasy', 'european']",['US'],,,,,4.032,7.5
tm311313,The Honor Farm,MOVIE,"On prom night, a group of kids wander deep into the woods and come back changed forever.",2017,,74,"['thriller', 'drama']",['US'],,tt4022758,3.7,346.0,2.941,4.4
tm323258,Breakdown Lane,MOVIE,"When Kirby Lane's SUV breaks down in the middle of the desert, she must overcome the dehydration, coyotes, and lurking undead to find her way home.",2017,,76,"['horror', 'thriller', 'action', 'drama']",['CA'],,tt3121200,2.8,464.0,3.529,3.8
tm351047,Blood Honey,MOVIE,"Tortured by the memory of a childhood trauma, a woman returns after a decade to her family's fly-in hunting lodge to assist her siblings with their dying father, only to find herself stuck in a life threatening nightmare.",2017,,95,"['thriller', 'horror', 'drama']",['CA'],,tt1380151,4.7,1339.0,4.831,4.9
tm314270,Molly,MOVIE,A girl living alone in a post apocalyptic wasteland finds herself hunted down by marauders who want her to fight in their fighting pit for their entertainment.,2017,PG-13,90,"['scifi', 'action', 'family', 'documentation']",['NL'],,tt6992054,4.2,1430.0,1.358,5.0
tm376336,Dark Beacon,MOVIE,"An abandoned paramour tracks her lover down to a distant lighthouse. When she finds her beyond hope, she must find a way to save a child from the malignant spirit of her deceased father and the madness of her mother.",2017,,75,"['thriller', 'horror']",['GB'],,tt3889156,4.7,1639.0,5.286,4.9
tm359708,Scarecrows,MOVIE,"Teenagers are kidnapped and made into scarecrows, that are left to die in the crop fields.",2017,,80,"['horror', 'comedy']",['CA'],,tt5283288,4.1,766.0,4.761,5.1
tm427387,Seeds,MOVIE,"When his increasingly depraved behavior spirals out of control, Marcus retreats to his family home along the New England coast. But instead of finding solace, Marcus is haunted by his darkest fears and deepest desires.",2018,,90,"['thriller', 'horror']",['US'],,tt3895908,4.0,1560.0,11.915,5.0
tm448995,Night Shift,MOVIE,"Amy begins her first night shift in a hotel with a murderous past. Witnessing terrifying events and trapped within a loop, Amy must find a way to escape the flesh obsessed murderer and save residents of the hotel.",2018,,81,"['horror', 'thriller', 'european']",['IE'],,tt6688304,4.0,590.0,3.192,5.7
tm470940,Softness of Bodies,MOVIE,"An American poet living in Berlin hopes to win a prestigious grant while dealing with her former relationships, a rival poet, and her own penchant for stealing things.",2018,,74,"['drama', 'comedy']",['US'],,tt6924682,4.9,175.0,0.978,8.0
tm345377,Lady Bug,MOVIE,A chemically dependent woman loses control of her life. Willing to do anything to get to her children in a far off city. She stows away on a private boat only to find herself face to face with a homicidal maniac.,2017,,101,['thriller'],['US'],,tt4679786,4.5,99.0,1.863,4.7
tm374218,Number 37,MOVIE,"Entrapped in his apartment, Randal, a recent paraplegic, is given a gift of binoculars by his devoted girlfriend, Pam. But Randal is in financial debt to a sadistic loan shark, and when he witnesses a powerful criminal commit a murder while observing his neighbours through binoculars, he initiates a treacherous blackmail scheme.",2018,,100,['thriller'],['ZA'],,tt6985448,6.3,576.0,3.067,5.4
tm431731,Red Room,MOVIE,"Held hostage in an isolated house, three kidnapped women attempt to escape from their sadistic captors.",2017,R,96,"['thriller', 'horror', 'european']",['IE'],,tt5738830,3.4,256.0,1.89,6.0
tm317947,Lake Alice,MOVIE,The Thomas family goes out to their forest cabin to celebrate Christmas together with their daughter and her boyfriend. But their first festive period together may be their last…,2018,R,80,"['horror', 'action']",['US'],,tt3923004,3.7,2061.0,2.645,4.0
tm869294,A Stargazers Guide to the Cosmos,MOVIE,"Amateur astronomer Greg Quicke (a.k.a. Space Gandalf) presents the ultimate beginners guide to the southern sky. The Pearl Diver’s Guide to the Galaxy invites its audience to re-discover both the wonder of the night sky and the fundamental, basic science behind how it works. After a night of stargazing with Greg, people often report a profound shift in the way that they see both the stars and the planet beneath their feet. The aim of this series is for viewers to experience the same thing.",2018,,56,['documentation'],[],,tt11132526,,,0.6,
tm366620,Viking Siege,MOVIE,"During a wild night of debauchery, a gang of vengeful women plot to massacre a monastery full of corrupt monks who sold their loved ones as slaves. Their plan comes unstuck when a gang of marauding Vikings arrive with an army of vicious, tree-like demons on their tail..",2017,,99,"['action', 'fantasy', 'horror']",['GB'],,tt5555824,3.1,174.0,2.863,7.0
tm427378,Lasso,MOVIE,"The story of Simon and Kit, two young leaders of an Active Senior adventure tour group that take a day trip out to a small-town Rodeo located deep in the woods. Their lives are turned upside down when they find themselves fighting to stay alive against a group of psycho, bloodthirsty cowboys from the local rodeo.",2017,,97,"['thriller', 'horror']",['US'],,tt5851598,4.8,633.0,6.008,6.5
tm319575,Mermaids,MOVIE,"In this tribute to the eternal allure of an ancient myth, colourful fins and swimming pools fill the lives of five modern-day women who strive to embody the mysterious siren as part of a growing “mermaiding” subculture.",2017,,76,['documentation'],['CA'],,tt6089682,6.1,36.0,1.343,6.3
tm406664,World of Darkness,MOVIE,"An in-depth look into how the World of Darkness and Vampire: The Masquerade created a phenomenon in the 1990s – a zeitgeist that helped shape film, literature, fashion, club culture, and ultimately fans, whose lives it forever altered.",2017,,89,"['documentation', 'european']",['SE'],,tt6177752,6.4,207.0,0.968,6.9
tm346504,Euthanizer,MOVIE,"Euthanizer tells the story of a mechanic who euthanises sick and old pets as a side job. Despite the grim work, he has a soft spot for the animals. Trouble stirs when the owner of a dog he was supposed to end realises that the canine is still alive. The only innocent party in the drama that ensues is the dog itself.",2017,,85,"['thriller', 'comedy', 'drama', 'horror', 'european']",['FI'],,tt6505968,6.7,1964.0,4.278,6.8
tm446897,A Fistful of Lead,MOVIE,"Four of the West's most infamous outlaws carry out a daring bank heist in the gold-rush town, Bath Water. As the posse takes chase, things take a turn for the worse, as the bandits realize they've been double-crossed - but by who?",2018,,86,['western'],['GB'],,tt7468604,3.8,213.0,9.78,4.8
tm406678,Luciferina,MOVIE,"After receiving bad news, Natalia, a young novice, returns home, where her sister Ángela asks her to travel with her and her friends to a mysterious place.",2018,R,115,['horror'],['AR'],,tt8072078,4.6,593.0,7.605,6.1
tm453482,Haunted 2: Apparitions,MOVIE,Sequel to the 2013 film 'Haunted',2018,,88,['horror'],['GB'],,tt2281442,2.2,252.0,0.728,5.3
tm453282,Wretch,MOVIE,"In an attempt to piece together fractured memories of a drug-fueled night in the woods, three friends confront guilt, jealousy, and a supernatural presence that threatens to expose their true natures.",2018,,89,['horror'],['US'],,tt7221072,3.6,310.0,2.843,3.9
tm432241,The Prey,MOVIE,An innocent man sentenced to rot in a Cambodian jail is released for the sadistic pleasure of twisted trophy hunters and forced to fight - or die.,2018,,94,"['crime', 'action']",['KH'],,tt8254080,5.5,273.0,8.719,5.1
tm345457,The Ice Cream Truck,MOVIE,Mary moves back to her suburban hometown to find that the suburbs are scarier in more ways than she ever remembered.,2017,,96,"['horror', 'thriller', 'comedy']",['US'],,tt6102306,4.6,2988.0,7.132,4.5
tm246635,A Place in Hell,MOVIE,Inspired by a real serial killer: A disgraced detective on the trail of a serial killer and a group of student filmmakers cross paths at a Halloween fright farm in the dead of winter.,2018,,87,"['thriller', 'horror']",['US'],,tt4907108,3.1,291.0,2.116,5.5
tm320268,Alien Vs. Zombies,MOVIE,"Joe Alien fulfills a dream of coming to Earth to find that it's overrun by zombies. Finding an ally in young Parker, he attempts to save the world!",2017,,70,"['horror', 'comedy']",['US'],,tt4947748,3.4,113.0,6.085,4.5
tm521828,Fat Tuesday,MOVIE,"Behind the mask of Mardi Gras, something sinister stalks the streets of New Orleans. Filmed on-location during the final days of Carnival, a group of friends is preyed upon by a mysterious killer.",2018,,79,['horror'],['US'],,tt6843652,5.4,23.0,1.214,
tm433231,Armed,MOVIE,A former U.S. marshal discovers that all of the survivors of his old unit are experiencing the same symptoms simultaneously and there may be a larger conspiracy at hand.,2018,R,120,"['thriller', 'action']",['XX'],,tt4824316,3.4,465.0,2.533,4.8
tm361827,August Falls,MOVIE,"Struggling to find the truth behind her son's mysterious death, an estranged mother must confront her own hidden guilt.",2017,,98,"['thriller', 'drama']",['US'],,tt3663718,5.8,113.0,1.397,3.0
