id,title,type,description,release_year,age_certification,runtime,genres,production_countries,seasons,imdb_id,imdb_score,imdb_votes,tmdb_popularity,tmdb_score
tm33299,America's Alien Invasion: The Lost UFO Encounters,MOVIE,"- Most Americans have no idea that the White House was swarmed by UFOs not once but twice, once in 1952 and again in 1963. The government knows that UFOs are here. Explore this phenomenon that is destined to impact our very being because we are not alone. -",2012,,61,['documentation'],['US'],,tt3314120,4.6,12.0,0.6,
tm65525,Lost Lake,MOVIE,"A young couple travels to a deserted town to try and find their mysterious uncle, only to discover that ghosts are real and very dangerous.",2012,R,80,"['thriller', 'horror']",['US'],,tt1890455,3.3,336.0,3.683,4.0
tm33356,The Last Tycoon,MOVIE,"Cheng, a young man who is set up by the chief of police, must leave the life he knows and Qiu, the woman he loves, to start again. After escaping prison Cheng quickly and violently moves his way up the ladder of Shanghais criminal underworld to become on the most powerful mob bosses in Shanghais history. But fame and notoriety take their toll when Cheng finds himself stuck between the looming Japanese army and the scheming local secret service. Matters are only made worse when he bumps into the love of his life QIU, along with her writer husband. Will love re-kindle in the dusk of an era?",2012,,118,"['drama', 'action', 'crime']",['CN'],,tt2458314,6.6,1993.0,3.543,6.5
tm52554,Painted Skin: The Resurrection,MOVIE,"According to demon lore, it takes hundreds of years to attain human form. Even then, lacking a human heart, a demon cannot experience the true pains and passions of existence. However, there is a legend that if a pure human heart is freely offered to a demon, it can become a mortal and experience true life.  Sequel of Painted Skin (2008).",2012,,131,"['fantasy', 'romance']",['CN'],,tt2371411,6.2,3428.0,6.328,5.8
tm97891,Mask Maker,MOVIE,"A lucky couple hits the jackpot when they purchase a 19th century plantation home for pennies on the dollar. Determined to get rich quick, they invite their friends up for the weekend to celebrate their good fortune. It’s quickly apparent that the plantation home’s former residents have not left and the unlucky youths suddenly find themselves running for their lives!",2011,R,90,['horror'],['US'],,tt1577055,4.7,1894.0,5.924,5.4
tm63475,Creeping Crawling,MOVIE,"An eccentric Entomologist tells three dark tales about the creeping crawling insects that burrow through the walls of homes, eat through our intestines, and for some of us, driving us slowly insane.",2012,,120,['horror'],['US'],,tt2234035,4.5,104.0,1.453,2.0
tm165814,The Fields,MOVIE,Tells the story of a young boy and his family who are terrorized by an unseen presence.,2011,,100,"['thriller', 'horror', 'drama']",['US'],,tt1401236,4.3,1805.0,2.262,4.2
tm60199,Berlin Job,MOVIE,"Infamous London gangster cousins, Micky Mannock and Ray Collishaw, are at the top of the food chain, when their world is turned upside down as they lose a shipment of the Russian Mafia's cocaine in rough seas. Set in London, Amsterdam and Berlin, the story races across Europe at breakneck speed as Micky and Ray attempt to stay one step ahead of the Police. Can they pull off a daring diamond heist in time to put things right and retire to a ""legitimate"" way of life?",2012,,97,[],['GB'],,,,,1.4,6.7
tm41797,Preston Castle,MOVIE,"When Liz returns home on a college break, her best friend Ashley coaxes her out for a rendezvous with ex-boyfriend Danny at Preston Castle, an abandoned boys correctional institute with a gruesome past. What begins as a dare for the three teens seeking weekend excitement, turns into a grisly nightmare as they try to escape an evil presence still lurking on the terrifying grounds. As they probe the decaying depths and shadows of Preston Castle, they find themselves in deeper and deeper trouble with no way out from the maze of rooms and locked doors. Trapped inside, they’re caught in a horrifying life and death struggle with the unstoppable evil. Will they all survive the night?",2012,,83,['horror'],['US'],,tt2521436,5.4,1188.0,1.956,5.2
tm215087,The Ecstasy of Isabel Mann,MOVIE,"Teenager Isabel Mann is seduced by a violent sect of day-walking vampires. Her classmates start to go missing, attracting two detectives.Things get weird as the disturbed teenager kills at will in the nearby woods. She's aided by head vampire Alejo, and eerily by Isabel's lost mother, an earlier recruit. She's trained in the art of the kill with horrifically bloody results for those she loves.",2012,,90,"['horror', 'european']",['IE'],,tt2524934,2.8,120.0,0.993,6.3
tm38455,Slaughter Creek,MOVIE,"In February of 2006, a documentary film crew from Dallas, Texas followed a young woman as she began her career in the porn industry. By March, she had disappeared.",2012,,94,"['horror', 'drama']",['US'],,tt1336106,3.1,219.0,1.471,3.0
tm165431,The Legend of Hell's Gate: An American Conspiracy,MOVIE,"In 1870s Texas, a ruthless bounty hunter and an Irish desperado flee the law with a young criminal claiming to possess a treasure more valuable than gold. Crossing paths with some of the West’s most notorious figures, the three outlaws fight for their lives in the pursuit of fame and fortune. Fueled by an ensemble cast and inspired by actual events, THE LEGEND OF HELL’S GATE blends legend and history into a Western spectacle that recounts a treacherous existence in post Civil War Texas.",2011,PG-13,108,"['western', 'thriller', 'crime', 'drama', 'action', 'history']",['US'],,tt1220217,4.1,776.0,4.527,4.1
tm45614,Infliction,MOVIE,"""Infliction"" is the actual assembled footage taken from the cameras belonging to two brothers, who documented a murder spree in North Carolina.",2012,,100,['horror'],['US'],,tt2505856,5.1,952.0,3.018,3.7
tm175736,The Haunting of Fox Hollow Farm,MOVIE,"In the early 1990s the property was bought on contract by Herb Baumeister, a local business owner and family man. Although never brought to trial, he was the prime suspect in the disappearance of a number of individuals from the Midwest through two decades. Over a six-month period, six paranormal investigation teams,including psychics, a demonologist, EVP and visual specialists,investigated an 18-acre estate in Westfield, Indiana known as Fox Hollow Farm.",2011,R,67,['documentation'],['US'],,tt2075337,5.4,708.0,1.868,1.2
tm167495,Catalunya über alles!,MOVIE,"A former convict, an immigrant unemployed and a successful entrepreneur are the three protagonists of this portrait of inland Catalonia, which highlights the challenge of integrating newcomers and tolerance of people, under the demagogic threat of extremism.",2011,,100,"['european', 'drama']",['DE'],,tt1785326,6.2,128.0,0.6,5.0
tm66307,P.O.E. : Project of Evil,MOVIE,"Following up the successful ""P.O.E.: Poetry of Eerie"", some of the original filmmakers regrouped for this newest experiment which aims to bring the tales of Edgar Allen Poe to life through the distinct lens of Italian horror with spoken English. While the original film's focus was the poetic and macabre dimension of the infamous Boston author, this sequel focuses instead on the bloody, violent and disturbing. Stories include 'The Pit and the Pendulum', 'Solo', 'Loss of Breath', 'The Murders in the Rue Morgue', 'The Tell-Tale Heart', 'The System of Dr. Tar and Prof. Feather', and 'The Premature Burial'... Like you've never seen before!",2012,,92,"['horror', 'european']","['FR', 'IT']",,tt2450520,3.0,232.0,2.586,4.9
tm628306,Recipe for Murder,MOVIE,"Sydney, the early 1950's... a city in the grip of a deadly crime wave. In just over a year more than one hundred people were poisoned. Most of the killers were women. Recipe For Murder tells the true story of three notorious poisoners; Yvonne Fletcher, Caroline Grills and Veronica Monty. The 52 minute film combines gritty archive with stunning film noir re-enactments and interviews with witnesses. Narrated by Dan Wyllie in classic pulp crime style, the film dramatically reveals the unique ingredients that created a Recipe For Murder.",2011,,55,"['documentation', 'crime']",['AU'],,tt1948134,7.2,25.0,,
tm60548,Alien from Area 51: The Alien Autopsy Footage Revealed,MOVIE,In this documentary Ray Santilli and Gary Shoefield explain how their lives have changed since they made footage of an alien autopsy available to the public in a 1995 television special. They also explain how governments around the world are keeping the truth hidden from us.,2012,,75,['documentation'],['US'],,tt2395137,3.7,36.0,0.6,5.5
tm174660,The Cinema Hold Up,MOVIE,"The story of four teenagers: Negus, Chale, Sapo and Chata. Childhood friends living in public housing in a rundown area of Mexico City, search to trump idleness. They toy with the idea of robbing a movie theatre. Afflicted by their past and present stance, each find the motivation to complete the deed. The adventure pushes them to face their own realities and jeopardizes the only valuable possession: friendship",2011,,112,['drama'],['MX'],,tt1741690,5.9,140.0,1.443,5.6
tm181946,Bunohan,MOVIE,"3 brother return to the village of Bunohan with three very different reasons; they will encounter death, deceit and a very grim revelation.",2011,,97,"['drama', 'action']","['MY', 'US']",,tt2041321,5.9,506.0,1.4,5.7
tm63878,Devoured,MOVIE,Malevolent forces within the walls of an old restaurant torment a cleaning woman who is trying to earn enough money to pay for her son's operation.,2012,R,89,"['thriller', 'horror', 'drama']",['US'],,tt2010976,5.4,1638.0,4.113,5.7
tm606201,Ghostville,MOVIE,"When the living choose to seek communication with the souls of the dead, tempt fate by calling forth spirits in a state of unrest, tread where fear is sure to follow, they may find that all roads lead to Ghostville.",2012,,60,['documentation'],['US'],,tt2441212,7.7,170.0,,
tm57165,Deadly Presence,MOVIE,"After going to the house of a serial killer, a woman believes that an evil spirit may be haunting her.",2012,,90,['horror'],['US'],,tt2343086,2.8,161.0,0.6,5.0
tm626610,Weekend Killer,MOVIE,"Detectives Joey Moretti and Patricia Stevens are trying to track down a serial killer that preys on young attractive women, leaving only cryptic messages carved into their flesh as clues. Joey struggles to keep himself together as the investigation leads him closer and closer to the deranged killer.",2011,,87,['thriller'],['US'],,tt1978587,4.9,44.0,0.843,
tm173313,The Passing,MOVIE,"The three Naibert children, in their teens and early twenties, inherit a vast estate from their grandmother Rebecca. But unknown to them, the family inheritance has passed from grandmother to granddaughter for centuries-and Rebecca has a long reach from the grave to assure that the line is unbroken. The first weekend in the mansion is a party for the three Naiberts and their friends-but one by one, they vanish without a trace. Is death the punishment for violating Rebecca's spell? Are the demons that beset the young people real-or only reflections of their own fear? Is it murder, violence from another dimension, or madness? The answer lives in the reflections.",2011,R,105,['horror'],['US'],,tt0451154,3.2,231.0,1.363,2.8
tm415862,Dark Flower,MOVIE,"A group of paranormal investigators set out to their last chance of creating their own TV show successful. While on their adventure to an ancient town, they encounter more than they bargained for. This film is made with the real footage and investigative tapes by the one who lived to tell the story of the Dark Flower.",2011,,70,['horror'],[],,,,,0.6,
tm44903,Sharkproof,MOVIE,"Broke, busted, and living in a tent outside their parents backyard. Vince and Freddy hit on the idea of a lifetime, Sharkproof wetsuits, and are determined to strike it rich. They go to a local loan shark, Max who owns a club in downtown LA to fund the venture. At the club they both fall in love with the same girl, Isabella the receiving half of knife throwing duo who are preforming at the club. Yuri is her drunk, knife-throwing partner. When Isabella chooses the boys over Max he sends his goons to reclaim her. Suddenly the boys must become the men they pretend to be, but now it's sink or swim. Almost Sharkproof, a bromantic comedy.",2012,,90,"['comedy', 'action']",['US'],,tt2392804,5.2,94.0,1.238,
tm33452,The Legend of Harrow Woods,MOVIE,"Horror movie, following the adventures of a group of students who enter the haunted forest Harrow Woods. With the aim of investigating the disappearance of horror novelist George Carney, a group of students, encouraged by Gary, enter the forest where he was last seen two years ago. Uncovering more than they had bargained for - not least that the infamous 17th century witch Lenore Selwyn was burnt at the stake in Harrow Woods and died laying a curse upon the ground beneath her - the students soon find themselves in a battle for survival. Written by Susan Thompson",2012,,90,['horror'],[],,tt6447376,,,0.6,0.5
tm33513,The Phoenix Rises,MOVIE,"Worlds collide when a team of brilliant scientists are recruited to work with a secretive government run project called the Phoenix Program to develop counter measures for climate based weaponry. Special Agents Bob Smith and Tom Jones hand picked the team after observing their success with building the worlds first space elevator for the Bonner Prize a secret recruitment project purposed to find the worlds best and brightest. A newly formed terrorist group is using climate based weapons to hold the US and its allies hostage. Using extremely low frequency delivery methods the terrorists can cause earthquakes, alter rain patterns, cause droughts, and create deadly storms seeming out of thin air; but the terrorist threat is not the only challenge for the team. A deadly, vindictive mercenary from their past, Jamal Duegro, has launched a revenge operation to reacquire technologies his clients want returned to them and will stop at nothing in order to protect his interests.",2012,,85,"['thriller', 'scifi']",['US'],,tt2511058,2.0,162.0,1.834,3.9
tm892866,Seance,MOVIE,"Based on a true story. After William Trigger’s finance dies in a car accident, his life begins to spiral downwards into loneliness and seclusion. Taking a friend’s advice, he attends a gathering, unaware that a seance is waiting for him on his arrival to try and contact the deceased. When he returns home things are not what they seem. Something or someone begins to haunt him. A frightening tale of one man’s decent into madness, the supernatural and the doors to the other side.",2011,,75,['thriller'],[],,,,,0.6,
tm33925,Ghost and Demon Children of the Damned,MOVIE,"Documentary / Horror - Ghosts and demons send chills up your spine, but there is something extra disturbing when they are children! Meet Children of the Damned who can be found shrieking in tunnels, moving objects, animating dolls, haunting the living and looking for revenge.",2012,,60,['documentation'],['US'],,tt4254564,,,0.6,
tm178540,Hard Romanticker,MOVIE,"Writer-director Gu Su-yeon's new film draws on his own semiautobiographical account of growing up as a delinquent zainichi Korean (Japanese-born, but of Korean ancestry) in the seaside city of Shimonoseki in Yamaguchi Prefecture, a working-class hellhole overflowing with sex and fury. Day after day, (fictional) Gu finds fresh foes and makes the local hoodlums want to kick his ass. While working multiple dead-end part-time jobs, he cruises around town on his scooter in search of gangland trouble: leaping across rooftops with irate hordes of punks in hot pursuit, running off with a fetching belle in a sailor suit, rescuing a schoolgirl from being gang-raped at a glue-sniffing orgy…",2011,PG-13,108,['drama'],['JP'],,tt1924283,6.1,299.0,1.198,7.0
tm34904,Ancient Alien Question: From UFOs to Extraterrestrial Visitations,MOVIE,"Have we been visited by extraterrestrial beings?  Did these ""ancient aliens"" contribute to the birth of human civilization?  Do our ancient monuments contain evidence of their presence?",2012,,70,['documentation'],['US'],,tt2398123,5.6,56.0,1.843,3.0
tm140440,Jamie Marks Is Dead,MOVIE,"No one seemed to care about Jamie Marks until after his death. Hoping to find the love and friendship he never had in life, Jamie’s ghost visits former classmate Adam McCormick, drawing him into the bleak world between the living and the dead.",2014,,100,"['thriller', 'fantasy', 'drama']",['US'],,tt2381046,5.5,2374.0,5.068,5.5
tm159356,These Final Hours,MOVIE,"What would you do on the last day on Earth?  With the end of the world only hours away, the self-absorbed James heads to the ultimate party-to-end-all-parties. On his way there, he saves the life of a young girl named Rose who is searching desperately for her missing father. This simple act sets James on a path to redemption.",2014,R,87,"['thriller', 'scifi', 'drama', 'action']",['AU'],,tt1935090,6.7,17337.0,9.284,6.5
tm180056,The Institute,MOVIE,"Thousands of participants in a San Francisco-based alternate reality game end up getting more than they bargained for. Told from the players’ perspectives, the film looks over the precipice at an emergent new art form where the real world and fictional narratives merge to create unforeseen and often unsettling consequences. Examining counter-culture, new religious movements and street art, this film takes the viewer on a journey into a secret underground world teeming just beneath the surface of everyday life.",2013,,92,"['documentation', 'crime', 'scifi', 'romance', 'comedy', 'drama']",['US'],,tt1691856,6.2,1288.0,2.885,6.1
tm146508,Dead Snow 2: Red vs. Dead,MOVIE,"The gruesome Nazi Zombies are back to finish their mission, but our hero is not willing to die. He is gathering his own army to give them a final fight.",2014,R,100,"['horror', 'european', 'action', 'comedy', 'fantasy']","['IS', 'NO', 'GB', 'US']",,tt2832470,6.9,24343.0,10.904,6.6
tm173436,Night Moves,MOVIE,The story about three radical environmentalists coming together to execute the most intense protest of their lives: the explosion of a hydroelectric dam.,2014,R,112,"['thriller', 'drama', 'action']",['US'],,tt3183964,6.0,15600.0,8.695,5.8
tm187209,Hell Baby,MOVIE,"After she and her husband move into a haunted house, a woman gives birth to a demonic infant that wreaks havoc.",2013,R,98,"['comedy', 'horror']",['US'],,tt2318527,4.9,9352.0,15.098,5.2
tm180072,Jug Face,MOVIE,"When a supernatural pit worshipped by a remote community in the woods demands a new blood sacrifice, a young woman struggles to find a way to survive as the pit lashes out in anger.",2013,R,81,"['drama', 'horror', 'thriller']",['US'],,tt3597136,5.2,7208.0,5.997,5.3
tm169403,New World,MOVIE,An undercover cop has his loyalties tested when the boss of the corporate gang he's spent years infiltrating dies.,2013,,134,"['thriller', 'action', 'crime', 'drama']",['KR'],,tt2625030,7.6,22906.0,8.674,7.4
tm140972,R100,MOVIE,Ruthless dominatrixes pursue a mild-mannered salesman who wants to get out of his unbreakable contract with a secret bondage club.,2013,,100,"['comedy', 'drama']",['JP'],,tt2914838,6.0,2543.0,6.298,5.9
tm160853,Open Windows,MOVIE,"Nick is excited to discover that he's won a dinner date with his favorite actress, Jill Goddard. But when Jill refuses to honor the contest, he receives an offer he can't refuse: the ability to view Jill secretly via computer. Nick begins watching the unknowing star on her webcam, not realizing that this decision will put both himself and Jill at risk as they enter a terrifying world of cat-and-mouse where nothing-and no one-are as they seem.",2014,R,101,"['thriller', 'european', 'horror', 'action', 'drama', 'crime', 'documentation']","['FR', 'US', 'ES']",,tt5215554,5.1,14278.0,8.881,5.1
tm143211,The Treatment,MOVIE,"Inspector Nick Cafmeyer seems to have it all - looks, brains and a successful career.  But a dark cloud hangs over his life: since the age of nine, he has been haunted by the unsolved disappearance of his younger brother, Bjorn. Plettinckx, a known sex offender, was questioned but quickly released. Plettinckx lives close by and takes fiendish pleasure in harassing Nick. Then, when a disturbing case comes to light involving a missing nine-year-old, Nick heads a massive search which turns into a relentless manhunt.",2014,PG-13,131,"['thriller', 'european']",['BE'],,tt3089778,7.1,8917.0,6.295,6.9
tm193189,Mythica: A Quest for Heroes,MOVIE,"Stuck in a life of indentured servitude, Marek dreams of becoming a wizard. When she meets the beautiful priestess Teela in need of help, she offers her assistance and provides a motley troupe. Together they go in search of Teela's sister, who was kidnapped by a wild ogre.",2014,,93,"['fantasy', 'scifi', 'action']",['US'],,tt3405714,5.7,7204.0,9.586,6.0
tm180215,Police Story: Lockdown,MOVIE,"A man looking for the release of a long-time prisoner takes a police officer, his daughter, and a group of strangers hostage.",2013,PG-13,108,"['thriller', 'crime', 'drama', 'family', 'action']","['CN', 'HK']",,tt2599716,6.0,9792.0,10.664,6.1
tm140233,Lyle,MOVIE,A mother's grief over the death of her toddler leads to horror.,2014,,65,"['horror', 'drama']",['US'],,tt3450936,5.7,539.0,3.556,4.0
tm155607,The Connection,MOVIE,"Newly transferred to the bustling port city of Marseille to assist with a crackdown on organized crime, energetic young magistrate Pierre Michel is given a rapid-fire tutorial on the ins and outs of an out-of-control drug trade. Pierre's wildly ambitious mission is to take on the French Connection, a highly organized operation that controls the city's underground heroin economy and is overseen by the notorious —and reputedly untouchable— Gaetan Zampa. Fearless, determined and willing to go the distance, Pierre plunges into an underworld world of insane danger and ruthless criminals.",2014,R,135,"['thriller', 'action', 'crime', 'european']","['FR', 'BE']",,tt2935564,7.1,10678.0,5.849,7.1
tm141942,We Still Kill the Old Way,MOVIE,A group of aging London gangsters go on a vigilante killing spree when one of their number is murdered by a street gang.,2014,,94,"['crime', 'drama', 'thriller', 'action', 'comedy']",['GB'],,tt3157224,6.0,4354.0,5.126,6.0
tm134938,Kung Fu Jungle,MOVIE,"A martial arts instructor working at a police academy gets imprisoned after killing a man by accident. But when a vicious killer starts targeting martial arts masters, the instructor offers to help the police in return for his freedom.",2014,,100,"['thriller', 'action', 'crime', 'drama']","['HK', 'CN']",,tt2952602,6.4,11037.0,31.364,6.7
tm182744,Rigor Mortis,MOVIE,"Juno Mak’s debut feature Rigor Mortis is an eerie and chilling, contemporary action- and special effects-laden homage to the classic Chinese vampire movies of the 1980s.",2013,,105,"['horror', 'action']","['CN', 'HK']",,tt2771800,6.2,5945.0,8.275,6.1
tm170769,The Suspect,MOVIE,"Betrayed and on the run, a former North Korean agent tries to seek revenge on the man who killed his wife, find his missing daughter, and uncover the secrets hidden inside the eyeglasses of a dead man.",2013,,137,"['thriller', 'action']",['KR'],,tt3404158,6.8,6150.0,9.166,7.0
tm154316,I'll Follow You Down,MOVIE,"After the disappearance of a young scientist on a business trip, his son and wife struggle to cope, only to make a bizarre discovery years later - one that may bring him home.",2013,PG-13,93,"['drama', 'thriller', 'scifi']",['CA'],,tt2368709,6.1,7174.0,8.448,6.0
tm159217,Killer Legends,MOVIE,"Delving into our collective nightmares, this horror-documentary investigates the origins of our most terrifying urban legends and the true stories that may have inspired them.",2014,,86,"['horror', 'documentation', 'crime', 'history']",['US'],,tt3449040,6.2,3361.0,5.097,5.8
tm176489,Blood Punch,MOVIE,"Milton, a college dropout, was only supposed to cook meth for one day. Broken out of rehab by a brash young woman and her trigger-happy (""ex"") boyfriend and driven to a remote cabin the woods, Milton finds himself drawn into a dangerous love triangle gone haywire. The couple's deadpan half-truths spin around Milton like a song on repeat. They seem to read him like an open book, until a mysterious message opens his eyes to his cursed existence. With unlimited ammunition, any hunting tool they could desire, and an ever-growing body count, for what did Milton really sign up?",2014,,104,"['horror', 'thriller']",['US'],,tt2825230,6.3,2930.0,6.364,6.5
tm175840,Dark Mountain,MOVIE,"In March of 2011, three filmmakers disappeared in the Superstition Mountains of Arizona while documenting their search for the Lost Dutchman mine. Their bodies were never found... but their camera was.",2013,,82,"['thriller', 'scifi', 'horror']",['US'],,tt2443022,4.3,847.0,3.948,4.9
tm183693,Big Ass Spider!,MOVIE,"When a giant alien spider escapes from a military lab and rampages across the city of Los Angeles, it is up to one clever exterminator and his security guard sidekick to kill the creature before the entire city is destroyed.",2013,PG-13,80,"['scifi', 'action', 'comedy', 'thriller']",['US'],,tt1830713,5.3,7239.0,10.588,5.6
tm33489,Daddy's Little Girl,MOVIE,"After the police find Derek’s daughter brutally murdered on the beach, he vows to make the culprit suffer for his actions, even if that person is ‘part of the family.’  With careful research into the history of torture, Derek prepares himself and his basement for a week of brutal tactics that will make his daughter’s killer feel the pain that he has inflicted upon so many others.  In a time when stranger danger is ever present, a single father learns that it’s the ones you trust most who have to be watched the closest.",2014,,107,"['horror', 'thriller']",['AU'],,tt2214941,5.7,1464.0,2.718,6.4
